{
  "preCommit": {
    "runLinting": true,
    "runTypeCheck": true,
    "runTests": false,
    "autoFix": true,
    "stageFixed": true,
    "excludePatterns": ["*.min.js", "*.bundle.js", "dist/**", "build/**"]
  },
  "commitMsg": {
    "enforceConventionalCommits": true,
    "maxLength": 100,
    "allowedTypes": [
      "feat", "fix", "docs", "style", "refactor", 
      "perf", "test", "chore", "ci", "build", "revert"
    ],
    "requireScope": false,
    "allowedScopes": ["core", "cli", "tools", "utils", "workflows", "docs", "config"]
  },
  "prePush": {
    "runTests": true,
    "runBuild": true,
    "checkDependencies": false,
    "checkBranchProtection": true,
    "protectedBranches": ["main", "master", "develop"],
    "maxFileSize": 10485760
  },
  "general": {
    "packageManager": "auto",
    "verbose": false,
    "skipCI": false,
    "enableEmojis": true
  }
}